{
  "victim": {
    "class": "odfixture.ConfigVictimTest",
    "method": "expectsDefaultMode"
  },
  "polluters": [
    {
      "class": "odfixture.ConfigPolluterTest",
      "method": "pollute"
    }
  ],
  "original_failing_order": [
    {
      "class": "odfixture.AlwaysEarlyVictimTest",
      "method": "expectsLateFlagUnset"
    },
    {
      "class": "odfixture.ConfigPolluterTest",
      "method": "pollute"
    },
    {
      "class": "odfixture.ConfigVictimTest",
      "method": "expectsDefaultMode"
    }
  ],
  "reduced_sequence": [
    {
      "class": "odfixture.ConfigPolluterTest",
      "method": "pollute"
    },
    {
      "class": "odfixture.ConfigVictimTest",
      "method": "expectsDefaultMode"
    }
  ],
  "reproduction": {
    "successes": 20,
    "n": 20,
    "confidence": 0.95,
    "lower": 0.83887484172924,
    "upper": 1.0
  },
  "sequence_any_signature_failures": 20,
  "victim_alone": {
    "successes": 0,
    "n": 20,
    "confidence": 0.95,
    "lower": 0.0,
    "upper": 0.16112515827076002
  },
  "shared_resource": {
    "kind": "static-field",
    "class": "odfixture.Config",
    "field": "mode"
  },
  "polluter_write_location": {
    "class": "odfixture.ConfigPolluterTest",
    "method": "pollute",
    "bytecode_offset": 1
  },
  "victim_read_location": {
    "class": "odfixture.ConfigVictimTest",
    "method": "expectsDefaultMode",
    "bytecode_offset": 1
  },
  "failure_signature": {
    "exception_type": "java.lang.AssertionError",
    "message": "expected:<<N>> but was:<<N>>",
    "stack_trace": "org.junit.Assert.fail:89\norg.junit.Assert.failNotEquals:835\norg.junit.Assert.assertEquals:647\norg.junit.Assert.assertEquals:633\nodfixture.ConfigVictimTest.expectsDefaultMode:10"
  },
  "instrumentation_level": "static-only",
  "execution_record_reference": "C:\\Users\\zarpa\\OneDrive\\Documents\\GitHub\\FlakeTracee\\eval\\reports\\flaketrace-records\\20261010T162228Z-odfixture.ConfigVictimTest#expectsDefaultMode.jsonl",
  "source_integrity": {
    "passed": true,
    "details": "23 files hashed (SHA-256) before and after; all identical"
  },
  "outcome": "VERIFIED",
  "unresolved_reason": null,
  "limitations": [
    "instrumentation_level is static-only (Iteration 1); runtime instrumentation is Iteration 2.",
    "Static analysis only; no runtime evidence (Iteration 2).",
    "Calls into JDK classes and third-party jars are not followed.",
    "Virtual dispatch to subclasses and reflection are not resolved (see VIRTUAL_DISPATCH, REFLECTION).",
    "Only static fields and constant-key system properties are modelled. Files, environment variables, network, databases, singletons reached through instance fields, etc. are not.",
    "Written values are not modelled: a polluter that writes and then restores the original value still produces a WRITE.",
    "Execution timing is not modelled (e.g. a victim <clinit> read that happens before the polluter runs).",
    "Missing evidence is not proof of independence."
  ]
}
